{
  "$schema": "https://json-schema.org/draft/2020-12/schema",
  "title": "RKE Report Intelligence Markdown Coverage Summary",
  "type": "object",
  "required": [
    "coverage_id",
    "run_id",
    "selected_report_count",
    "pdf_download_ready_count",
    "markdown_ready_count",
    "markdown_quality_pass_count",
    "llm_extraction_processed_count",
    "llm_extraction_without_quality_pass_count",
    "industry_report_count",
    "stock_report_count",
    "stock_outcome_120d_ready_report_count",
    "coverage_targets",
    "coverage_shortfalls",
    "sector_bucket_coverage_gaps",
    "sector_bucket_below_min_count",
    "coverage_strata_targets",
    "coverage_strata_missing",
    "coverage_gate_status",
    "coverage_gate_blockers",
    "markdown_quality_gap_counts",
    "markdown_quality_review_queue_count",
    "markdown_quality_review_gap_counts",
    "markdown_false_positive_review_queue_count",
    "markdown_false_positive_risk_gap_counts",
    "markdown_quality_spot_check_required",
    "report_type_counts",
    "time_bucket_counts",
    "institution_bucket_counts",
    "sector_bucket_counts",
    "report_horizon_bucket_counts",
    "forecast_horizon_bucket_counts",
    "evaluability_bucket_counts",
    "stock_outcome_age_bucket_counts",
    "conversion_backend_counts",
    "retry_queue_count",
    "stratified_sampling_policy",
    "markdown_quality_review_policy",
    "private_artifact_redaction_policy",
    "private_text_included"
  ],
  "properties": {
    "coverage_id": {"type": "string", "minLength": 1},
    "run_id": {"type": "string", "minLength": 1},
    "selected_report_count": {"type": "integer", "minimum": 0},
    "pdf_download_ready_count": {"type": "integer", "minimum": 0},
    "markdown_ready_count": {"type": "integer", "minimum": 0},
    "markdown_quality_pass_count": {"type": "integer", "minimum": 0},
    "llm_extraction_processed_count": {"type": "integer", "minimum": 0},
    "llm_extraction_without_quality_pass_count": {"type": "integer", "minimum": 0},
    "industry_report_count": {"type": "integer", "minimum": 0},
    "stock_report_count": {"type": "integer", "minimum": 0},
    "stock_outcome_120d_ready_report_count": {
      "type": "integer",
      "minimum": 0
    },
    "coverage_targets": {
      "type": "object",
      "required": [
        "selected_report_count_min",
        "markdown_ready_count_min",
        "markdown_quality_pass_count_min",
        "llm_extraction_processed_count_min",
        "industry_report_count_min",
        "stock_report_count_min",
        "stock_outcome_120d_ready_report_count_min",
        "sector_bucket_min_report_count"
      ],
      "properties": {
        "selected_report_count_min": {"const": 300},
        "markdown_ready_count_min": {"const": 300},
        "markdown_quality_pass_count_min": {"const": 300},
        "llm_extraction_processed_count_min": {"const": 100},
        "industry_report_count_min": {"const": 80},
        "stock_report_count_min": {"const": 80},
        "stock_outcome_120d_ready_report_count_min": {"const": 30},
        "sector_bucket_min_report_count": {"const": 5}
      },
      "additionalProperties": {"type": "integer", "minimum": 0}
    },
    "coverage_shortfalls": {
      "type": "object",
      "required": [
        "selected_report_count",
        "markdown_ready_count",
        "markdown_quality_pass_count",
        "llm_extraction_processed_count",
        "industry_report_count",
        "stock_report_count",
        "stock_outcome_120d_ready_report_count",
        "sector_bucket_below_min_count",
        "coverage_strata_missing_count"
      ],
      "additionalProperties": {
        "type": "object",
        "required": ["current", "target", "remaining", "blocker", "next_action"],
        "properties": {
          "current": {"type": "integer", "minimum": 0},
          "target": {"type": "integer", "minimum": 0},
          "remaining": {"type": "integer", "minimum": 0},
          "blocker": {"type": "string", "minLength": 1},
          "next_action": {"type": "string", "minLength": 1}
        },
        "additionalProperties": true
      }
    },
    "sector_bucket_coverage_gaps": {
      "type": "array",
      "items": {"type": "string"}
    },
    "sector_bucket_below_min_count": {"type": "integer", "minimum": 0},
    "coverage_strata_targets": {
      "type": "object",
      "required": [
        "time_bucket_required",
        "institution_bucket_required",
        "horizon_bucket_required",
        "evaluability_bucket_required",
        "stock_outcome_age_bucket_required"
      ],
      "properties": {
        "time_bucket_required": {"type": "array", "items": {"type": "string"}},
        "institution_bucket_required": {"type": "array", "items": {"type": "string"}},
        "horizon_bucket_required": {"type": "array", "items": {"type": "string"}},
        "evaluability_bucket_required": {"type": "array", "items": {"type": "string"}},
        "stock_outcome_age_bucket_required": {
          "type": "array",
          "items": {"type": "string"}
        }
      },
      "additionalProperties": true
    },
    "coverage_strata_missing": {
      "type": "array",
      "items": {"type": "string"}
    },
    "coverage_gate_status": {"enum": ["passed", "blocked"]},
    "coverage_gate_blockers": {"type": "array", "items": {"type": "string"}},
    "markdown_quality_gap_counts": {
      "type": "object",
      "additionalProperties": {"type": "integer", "minimum": 0}
    },
    "markdown_quality_review_queue_count": {"type": "integer", "minimum": 0},
    "markdown_quality_review_gap_counts": {
      "type": "object",
      "additionalProperties": {"type": "integer", "minimum": 0}
    },
    "markdown_false_positive_review_queue_count": {
      "type": "integer",
      "minimum": 0
    },
    "markdown_false_positive_risk_gap_counts": {
      "type": "object",
      "additionalProperties": {"type": "integer", "minimum": 0}
    },
    "markdown_quality_spot_check_required": {"type": "boolean"},
    "report_type_counts": {
      "type": "object",
      "additionalProperties": {"type": "integer", "minimum": 0}
    },
    "time_bucket_counts": {
      "type": "object",
      "additionalProperties": {"type": "integer", "minimum": 0}
    },
    "institution_bucket_counts": {
      "type": "object",
      "additionalProperties": {"type": "integer", "minimum": 0}
    },
    "sector_bucket_counts": {
      "type": "object",
      "additionalProperties": {"type": "integer", "minimum": 0}
    },
    "report_horizon_bucket_counts": {
      "type": "object",
      "additionalProperties": {"type": "integer", "minimum": 0}
    },
    "forecast_horizon_bucket_counts": {
      "type": "object",
      "additionalProperties": {"type": "integer", "minimum": 0}
    },
    "evaluability_bucket_counts": {
      "type": "object",
      "additionalProperties": {"type": "integer", "minimum": 0}
    },
    "stock_outcome_age_bucket_counts": {
      "type": "object",
      "additionalProperties": {"type": "integer", "minimum": 0}
    },
    "conversion_backend_counts": {
      "type": "object",
      "additionalProperties": {"type": "integer", "minimum": 0}
    },
    "retry_queue_count": {"type": "integer", "minimum": 0},
    "stratified_sampling_policy": {
      "type": "object",
      "required": [
        "required_dimensions",
        "industry_report_count_min",
        "stock_report_with_ts_code_count_min",
        "sector_bucket_policy",
        "privacy_boundary"
      ],
      "properties": {
        "required_dimensions": {"type": "array", "items": {"type": "string"}},
        "industry_report_count_min": {"const": 80},
        "stock_report_with_ts_code_count_min": {"const": 80},
        "sector_bucket_policy": {"type": "string", "minLength": 1},
        "privacy_boundary": {"const": "aggregate_counts_only"}
      },
      "additionalProperties": true
    },
    "markdown_quality_review_policy": {"type": "string", "minLength": 1},
    "private_artifact_redaction_policy": {"type": "string", "minLength": 1},
    "private_text_included": {"type": "boolean", "const": false}
  },
  "additionalProperties": true
}
