{
  "conversion_backend_counts": {
    "hybrid-auto-engine": 59
  },
  "coverage_gate_blockers": [
    "selected_report_count_below_p9_target",
    "markdown_ready_count_below_p9_target",
    "markdown_quality_pass_count_below_p9_target",
    "llm_extraction_processed_count_below_p9_target",
    "industry_report_count_below_p9_target",
    "stock_report_count_below_p9_target",
    "sector_bucket_coverage_below_p9_target",
    "time_bucket_coverage_below_p9_target",
    "institution_bucket_coverage_below_p9_target"
  ],
  "coverage_gate_status": "blocked",
  "coverage_id": "RKE-REPORT-MARKDOWN-COVERAGE-SUMMARY",
  "coverage_shortfalls": {
    "coverage_strata_missing_count": {
      "blocker": "stratified_coverage_below_p9_target",
      "current": 2,
      "next_action": "fill_missing_time_institution_horizon_evaluability_strata",
      "remaining": 2,
      "target": 0
    },
    "industry_report_count": {
      "blocker": "industry_report_count_below_p9_target",
      "current": 23,
      "next_action": "add_more_industry_research_reports_to_stratified_pool",
      "remaining": 57,
      "target": 80
    },
    "llm_extraction_processed_count": {
      "blocker": "llm_extraction_processed_count_below_p9_target",
      "current": 59,
      "next_action": "run_llm_extraction_on_quality_passed_markdown",
      "remaining": 41,
      "target": 100
    },
    "markdown_quality_pass_count": {
      "blocker": "markdown_quality_pass_count_below_p9_target",
      "current": 59,
      "next_action": "resolve_markdown_quality_gaps_before_llm_extraction",
      "remaining": 241,
      "target": 300
    },
    "markdown_ready_count": {
      "blocker": "markdown_ready_count_below_p9_target",
      "current": 59,
      "next_action": "download_pdfs_and_convert_quality_gated_markdown",
      "remaining": 241,
      "target": 300
    },
    "sector_bucket_below_min_count": {
      "blocker": "sector_bucket_coverage_below_p9_target",
      "current": 4,
      "next_action": "fill_aggregate_sector_bucket_coverage_gaps",
      "remaining": 4,
      "target": 0
    },
    "selected_report_count": {
      "blocker": "selected_report_count_below_p9_target",
      "current": 59,
      "next_action": "add_stratified_real_reports_to_private_source_pool",
      "remaining": 241,
      "target": 300
    },
    "stock_outcome_120d_ready_report_count": {
      "blocker": "stock_outcome_120d_ready_count_below_p9_target",
      "current": 30,
      "next_action": "prefer_historical_stock_reports_with_120d_outcome_windows",
      "remaining": 0,
      "target": 30
    },
    "stock_report_count": {
      "blocker": "stock_report_count_below_p9_target",
      "current": 36,
      "next_action": "add_more_stock_research_reports_with_ts_code",
      "remaining": 44,
      "target": 80
    }
  },
  "coverage_strata_missing": [
    "time_bucket:long_cycle_history",
    "institution_bucket:head_institution"
  ],
  "coverage_strata_targets": {
    "evaluability_bucket_required": [
      "stock_proxy_candidate",
      "industry_proxy_candidate",
      "mapping_gap_candidate"
    ],
    "horizon_bucket_required": [
      "5d",
      "20d",
      "60d",
      "long_horizon"
    ],
    "institution_bucket_required": [
      "head_institution",
      "long_tail_institution"
    ],
    "stock_outcome_age_bucket_required": [
      "stock_outcome_120d_calendar_ready"
    ],
    "time_bucket_required": [
      "recent_1y",
      "recent_3y",
      "long_cycle_history"
    ]
  },
  "coverage_targets": {
    "industry_report_count_min": 80,
    "llm_extraction_processed_count_min": 100,
    "markdown_quality_pass_count_min": 300,
    "markdown_ready_count_min": 300,
    "sector_bucket_min_report_count": 5,
    "selected_report_count_min": 300,
    "stock_outcome_120d_ready_report_count_min": 30,
    "stock_report_count_min": 80
  },
  "evaluability_bucket_counts": {
    "industry_proxy_candidate": 11,
    "mapping_gap_candidate": 27,
    "no_forecast_claim_extracted": 32,
    "stock_proxy_candidate": 16
  },
  "forecast_horizon_bucket_counts": {
    "long_horizon": 6,
    "unknown": 89
  },
  "industry_report_count": 23,
  "institution_bucket_counts": {
    "long_tail_institution": 59
  },
  "llm_extraction_processed_count": 59,
  "llm_extraction_without_quality_pass_count": 0,
  "markdown_false_positive_review_queue_count": 0,
  "markdown_false_positive_risk_gap_counts": {},
  "markdown_quality_gap_counts": {},
  "markdown_quality_pass_count": 59,
  "markdown_quality_review_gap_counts": {},
  "markdown_quality_review_policy": "ready Markdown blocked by quality gates enters aggregate manual review counts before extraction is trusted; repeated-line, sparse structure, short, and empty-table gaps are tracked as false-positive risk classes for corpus spot checks",
  "markdown_quality_review_queue_count": 0,
  "markdown_quality_spot_check_required": false,
  "markdown_ready_count": 59,
  "pdf_download_ready_count": 59,
  "private_artifact_redaction_policy": "public coverage summary stores aggregate counts only; no source-specific content, retrieval locator, local file reference, or report prose is allowed",
  "private_text_included": false,
  "report_horizon_bucket_counts": {
    "20d": 24,
    "5d": 16,
    "60d": 24,
    "long_horizon": 27,
    "no_extracted_forecast_horizon": 32,
    "unknown": 27
  },
  "report_type_counts": {
    "个股研报": 36,
    "行业研报": 23
  },
  "retry_queue_count": 0,
  "run_id": "RIR-DERIVED-20260610T145604+0000",
  "sector_bucket_below_min_count": 4,
  "sector_bucket_counts": {
    "auto_transport": 6,
    "consumer": 3,
    "energy_materials": 11,
    "financials": 7,
    "healthcare": 9,
    "industrial_equipment": 5,
    "other_sector": 4,
    "real_estate_construction": 2,
    "technology_electronics": 10,
    "utilities_environment": 2
  },
  "sector_bucket_coverage_gaps": [
    "sector_bucket:consumer",
    "sector_bucket:other_sector",
    "sector_bucket:real_estate_construction",
    "sector_bucket:utilities_environment"
  ],
  "selected_report_count": 59,
  "stock_outcome_120d_ready_report_count": 30,
  "stock_outcome_age_bucket_counts": {
    "stock_outcome_120d_calendar_ready": 30,
    "stock_outcome_pending": 6
  },
  "stock_report_count": 36,
  "stratified_sampling_policy": {
    "industry_report_count_min": 80,
    "privacy_boundary": "aggregate_counts_only",
    "required_dimensions": [
      "report_type",
      "time_bucket",
      "institution_bucket",
      "sector_bucket",
      "stock_ts_code",
      "stock_outcome_age_bucket",
      "horizon_bucket",
      "evaluability_bucket"
    ],
    "sector_bucket_policy": "sector_bucket_counts are aggregate-only; high-frequency sector minimums are evaluated from the private source universe and recorded as coverage gaps before evolution promotion",
    "stock_report_with_ts_code_count_min": 80
  },
  "time_bucket_counts": {
    "recent_1y": 12,
    "recent_3y": 47
  }
}
